<?xml version="1.0" encoding="UTF-8"?>
<abeillebuilder version="" xmlns:xsi="http://www.w3.org/2001/XMLSchema-instance" xsi:noNamespaceSchemaLocation="abeille_toolbar.xsd">
    <toolbar>
		<bar description="JLabel">
		    <item ref="jlabel"/>
		    <item description="TEST1" ref="jlabel1"/>
		    <item description="TEST2" icon="development/16x16/web_component.png" ref="jlabel2"/>
		    		</bar>
		<bar description="JText">
		    <item ref="jtextfield"/>
		</bar>
	</toolbar>
</abeillebuilder>
